{
  "schema_version": "scientific-hypothesis-request-v1",
  "task_name": "null_result_update_demo",
  "research_question": "太阳活动周极小期长度主要由子午环流速度控制这一假设，在新的空结果实验后应如何更新？",
  "upstream_materials": [
    {
      "id": "mat_exp_null",
      "material_kind": "experiment_result",
      "title": "环流速度与极小期长度扩展样本相关分析（自动实验 Agent 真实执行记录）",
      "locator": "runs/exp_demo/flow_extended/record.json",
      "content_notes": "把相关分析扩展到第1至25活动周并统一环流代理口径后，环流速度与极小期长度的相关性不再显著。实验本身完成，属于科学空结果而非技术失败。",
      "experiment_summary": {
        "execution_completed": true,
        "outcome": "null_result",
        "metrics": [
          {
            "name": "扩展样本相关系数",
            "value_text": "跨25个活动周样本相关性不再显著",
            "definition": "统一口径表层环流代理与极小期长度的秩相关"
          }
        ],
        "uncertainty_notes": "早期活动周环流代理不确定性大；空结果不排除弱相关",
        "record_sha256": null
      }
    }
  ],
  "prior_hypotheses": [
    {
      "id": "prior_flow_v1",
      "statement": "太阳活动周极小期长度主要由子午环流速度控制：环流越快，磁通量输运越快，极小期越短。",
      "version": 1,
      "notes": "基于第12至25活动周小样本相关分析形成，置信度中等。"
    }
  ],
  "max_candidates": 3
}
