{
  "schema_version": "scientific-hypothesis-request-v1",
  "task_name": "cycle_minima_mechanism_demo",
  "research_question": "太阳活动周24与25极小期长度差异更可能由发电机机制还是观测口径差异解释？",
  "upstream_materials": [
    {
      "id": "mat_recalc",
      "material_kind": "experiment_result",
      "title": "极小期长度同口径复算实验",
      "locator": "runs/demo/recalc/report.md",
      "content_notes": "该实验用同一数据产品、同一平滑口径复算了第24与第25活动周的极小期长度，结论是第24周极小期比第25周长约8个月；未估计抽样不确定性。",
      "experiment_summary": {
        "execution_completed": true,
        "outcome": "completed",
        "metrics": [
          {
            "name": "极小期长度差",
            "value_text": "第24周极小期比第25周长约8个月",
            "definition": "同一数据产品同一平滑口径下的极小期间隔差"
          }
        ],
        "uncertainty_notes": "未估计抽样不确定性",
        "record_sha256": null
      }
    },
    {
      "id": "mat_note1",
      "material_kind": "literature_note",
      "title": "极小期定义综述笔记",
      "locator": "notes/minima_definitions.md",
      "content_notes": "笔记综述了三种常见的极小期判定口径，指出不同口径下同一活动周的极小期位置可能相差数月。",
      "experiment_summary": null
    }
  ],
  "prior_hypotheses": [],
  "max_candidates": 4
}
