{
  "schema_version": "scientific-hypothesis-request-v1",
  "task_name": "evidence_conflict_demo",
  "research_question": "太阳活动周极小期长度变化主要受哪种机制控制？",
  "upstream_materials": [
    {
      "id": "mat_exp_flow",
      "material_kind": "experiment_result",
      "title": "子午环流速度与极小期长度相关分析实验",
      "locator": "runs/exp_demo/flow_corr/record.json",
      "content_notes": "对第12至25活动周的表层子午环流速度指标与随后极小期长度做相关分析，发现显著正相关：环流越快，极小期越短。",
      "experiment_summary": {
        "execution_completed": true,
        "outcome": "completed",
        "metrics": [
          {
            "name": "环流速度与极小期长度相关系数",
            "value_text": "正相关，跨14个活动周样本显著",
            "definition": "表层子午环流年均速度与随后极小期长度的秩相关"
          }
        ],
        "uncertainty_notes": "样本仅14个活动周；环流速度为表层多普勒代理量",
        "record_sha256": null
      }
    },
    {
      "id": "mat_exp_polar",
      "material_kind": "experiment_result",
      "title": "极区磁场强度与下一周振幅前兆关系复验实验",
      "locator": "runs/exp_demo/polar_precursor/record.json",
      "content_notes": "复验极区磁场作为下一活动周振幅前兆的关系，发现第24周极小期极区磁场明显偏弱且其极小期偏长，与环流解释方向相反。",
      "experiment_summary": {
        "execution_completed": true,
        "outcome": "completed",
        "metrics": [
          {
            "name": "第24周极小期极区磁场",
            "value_text": "明显弱于此前三个极小期",
            "definition": "极小期前后一年极区平均磁场强度跨周比较"
          }
        ],
        "uncertainty_notes": "极区测量存在视角与仪器系统差",
        "record_sha256": null
      }
    }
  ],
  "prior_hypotheses": [],
  "max_candidates": 4
}
